[
  {
    "id": "xlsx-cinema-medium-01",
    "slug": "xlsx-cinema-medium-01",
    "language": "fr",
    "themeId": "cinema",
    "subthemeIds": [
      "cinema:essentials"
    ],
    "tags": [
      "essentials",
      "moyen"
    ],
    "questionText": "Cite 9 films appartenant à l’univers Harry Potter / Wizarding World.",
    "shortTitle": "films appartenant à l’univers Harry Potter /…",
    "difficultyLevel": 2,
    "difficultyLabel": "Moyen",
    "editorialDifficultyScore": 55,
    "specificityScore": 50,
    "popularityScore": 72,
    "recallDifficultyScore": 55,
    "answerSetHomogeneityScore": 82,
    "expectedAverageAnswers": 6,
    "playCount": 0,
    "difficultyConfidence": "medium",
    "validationMode": "editorial_panel",
    "answers": [
      {
        "id": "xlsx-cinema-medium-01-answer-1",
        "display": "Harry Potter à l'école des sorciers",
        "normalized": "harry potter a l ecole des sorciers",
        "aliases": [],
        "abbreviations": [],
        "alternativeSpellings": [],
        "accentInsensitiveVariants": [],
        "hyphenationVariants": [],
        "displayOrder": 1,
        "sources": []
      },
      {
        "id": "xlsx-cinema-medium-01-answer-2",
        "display": "Harry Potter et la Chambre des secrets",
        "normalized": "harry potter et la chambre des secrets",
        "aliases": [],
        "abbreviations": [],
        "alternativeSpellings": [],
        "accentInsensitiveVariants": [],
        "hyphenationVariants": [],
        "displayOrder": 2,
        "sources": []
      },
      {
        "id": "xlsx-cinema-medium-01-answer-3",
        "display": "Harry Potter et le Prisonnier d'Azkaban",
        "normalized": "harry potter et le prisonnier d azkaban",
        "aliases": [],
        "abbreviations": [],
        "alternativeSpellings": [],
        "accentInsensitiveVariants": [],
        "hyphenationVariants": [],
        "displayOrder": 3,
        "sources": []
      },
      {
        "id": "xlsx-cinema-medium-01-answer-4",
        "display": "Harry Potter et la Coupe de feu",
        "normalized": "harry potter et la coupe de feu",
        "aliases": [],
        "abbreviations": [],
        "alternativeSpellings": [],
        "accentInsensitiveVariants": [],
        "hyphenationVariants": [],
        "displayOrder": 4,
        "sources": []
      },
      {
        "id": "xlsx-cinema-medium-01-answer-5",
        "display": "Harry Potter et l'Ordre du Phénix",
        "normalized": "harry potter et l ordre du phenix",
        "aliases": [],
        "abbreviations": [],
        "alternativeSpellings": [],
        "accentInsensitiveVariants": [],
        "hyphenationVariants": [],
        "displayOrder": 5,
        "sources": []
      },
      {
        "id": "xlsx-cinema-medium-01-answer-6",
        "display": "Harry Potter et le Prince de sang-mêlé",
        "normalized": "harry potter et le prince de sang mele",
        "aliases": [],
        "abbreviations": [],
        "alternativeSpellings": [],
        "accentInsensitiveVariants": [],
        "hyphenationVariants": [],
        "displayOrder": 6,
        "sources": []
      },
      {
        "id": "xlsx-cinema-medium-01-answer-7",
        "display": "Harry Potter et les Reliques de la Mort – partie 1",
        "normalized": "harry potter et les reliques de la mort partie 1",
        "aliases": [],
        "abbreviations": [],
        "alternativeSpellings": [],
        "accentInsensitiveVariants": [],
        "hyphenationVariants": [],
        "displayOrder": 7,
        "sources": []
      },
      {
        "id": "xlsx-cinema-medium-01-answer-8",
        "display": "Harry Potter et les Reliques de la Mort – partie 2",
        "normalized": "harry potter et les reliques de la mort partie 2",
        "aliases": [],
        "abbreviations": [],
        "alternativeSpellings": [],
        "accentInsensitiveVariants": [],
        "hyphenationVariants": [],
        "displayOrder": 8,
        "sources": []
      },
      {
        "id": "xlsx-cinema-medium-01-answer-9",
        "display": "Les Animaux fantastiques",
        "normalized": "les animaux fantastiques",
        "aliases": [],
        "abbreviations": [],
        "alternativeSpellings": [],
        "accentInsensitiveVariants": [],
        "hyphenationVariants": [],
        "displayOrder": 9,
        "sources": []
      }
    ],
    "bomb": {
      "id": "xlsx-cinema-medium-01-bomb",
      "display": "Le Seigneur des anneaux",
      "normalized": "le seigneur des anneaux",
      "aliases": [],
      "abbreviations": [],
      "alternativeSpellings": [],
      "accentInsensitiveVariants": [],
      "hyphenationVariants": [],
      "explanation": "Bombe fournie par la banque de questions source."
    },
    "explanation": "Question et panel importés tels quels depuis la banque Excel source.",
    "qualificationRule": "Les réponses sont celles fournies dans la banque Excel source.",
    "timeSensitive": false,
    "sources": [],
    "status": "published",
    "reviewer": "Import Excel source",
    "reviewedAt": "2026-08-20T23:55:33.606Z",
    "duplicateJustification": "Fiche importée telle quelle depuis le classeur Excel source.",
    "answerSetFingerprint": "7a5a9fb29ce1bc0d987451315bbda9fd9e81152bdeb418aeda770eec488a08d4",
    "version": 4,
    "createdAt": "2026-08-20T23:55:33.606Z",
    "updatedAt": "2026-08-20T23:55:33.606Z"
  },
  {
    "id": "xlsx-cinema-medium-02",
    "slug": "xlsx-cinema-medium-02",
    "language": "fr",
    "themeId": "cinema",
    "subthemeIds": [
      "cinema:essentials"
    ],
    "tags": [
      "essentials",
      "moyen"
    ],
    "questionText": "Cite 9 films réalisés par Steven Spielberg.",
    "shortTitle": "films réalisés par Steven Spielberg",
    "difficultyLevel": 2,
    "difficultyLabel": "Moyen",
    "editorialDifficultyScore": 55,
    "specificityScore": 50,
    "popularityScore": 72,
    "recallDifficultyScore": 55,
    "answerSetHomogeneityScore": 82,
    "expectedAverageAnswers": 6,
    "playCount": 0,
    "difficultyConfidence": "medium",
    "validationMode": "editorial_panel",
    "answers": [
      {
        "id": "xlsx-cinema-medium-02-answer-1",
        "display": "Les Dents de la mer",
        "normalized": "les dents de la mer",
        "aliases": [],
        "abbreviations": [],
        "alternativeSpellings": [],
        "accentInsensitiveVariants": [],
        "hyphenationVariants": [],
        "displayOrder": 1,
        "sources": []
      },
      {
        "id": "xlsx-cinema-medium-02-answer-2",
        "display": "E.T. l'extra-terrestre",
        "normalized": "e t l extra terrestre",
        "aliases": [],
        "abbreviations": [],
        "alternativeSpellings": [],
        "accentInsensitiveVariants": [],
        "hyphenationVariants": [],
        "displayOrder": 2,
        "sources": []
      },
      {
        "id": "xlsx-cinema-medium-02-answer-3",
        "display": "Jurassic Park",
        "normalized": "jurassic park",
        "aliases": [],
        "abbreviations": [],
        "alternativeSpellings": [],
        "accentInsensitiveVariants": [],
        "hyphenationVariants": [],
        "displayOrder": 3,
        "sources": []
      },
      {
        "id": "xlsx-cinema-medium-02-answer-4",
        "display": "Les Aventuriers de l'arche perdue",
        "normalized": "les aventuriers de l arche perdue",
        "aliases": [],
        "abbreviations": [],
        "alternativeSpellings": [],
        "accentInsensitiveVariants": [],
        "hyphenationVariants": [],
        "displayOrder": 4,
        "sources": []
      },
      {
        "id": "xlsx-cinema-medium-02-answer-5",
        "display": "La Liste de Schindler",
        "normalized": "la liste de schindler",
        "aliases": [],
        "abbreviations": [],
        "alternativeSpellings": [],
        "accentInsensitiveVariants": [],
        "hyphenationVariants": [],
        "displayOrder": 5,
        "sources": []
      },
      {
        "id": "xlsx-cinema-medium-02-answer-6",
        "display": "Il faut sauver le soldat Ryan",
        "normalized": "il faut sauver le soldat ryan",
        "aliases": [],
        "abbreviations": [],
        "alternativeSpellings": [],
        "accentInsensitiveVariants": [],
        "hyphenationVariants": [],
        "displayOrder": 6,
        "sources": []
      },
      {
        "id": "xlsx-cinema-medium-02-answer-7",
        "display": "Arrête-moi si tu peux",
        "normalized": "arrete moi si tu peux",
        "aliases": [],
        "abbreviations": [],
        "alternativeSpellings": [],
        "accentInsensitiveVariants": [],
        "hyphenationVariants": [],
        "displayOrder": 7,
        "sources": []
      },
      {
        "id": "xlsx-cinema-medium-02-answer-8",
        "display": "Minority Report",
        "normalized": "minority report",
        "aliases": [],
        "abbreviations": [],
        "alternativeSpellings": [],
        "accentInsensitiveVariants": [],
        "hyphenationVariants": [],
        "displayOrder": 8,
        "sources": []
      },
      {
        "id": "xlsx-cinema-medium-02-answer-9",
        "display": "Ready Player One",
        "normalized": "ready player one",
        "aliases": [],
        "abbreviations": [],
        "alternativeSpellings": [],
        "accentInsensitiveVariants": [],
        "hyphenationVariants": [],
        "displayOrder": 9,
        "sources": []
      }
    ],
    "bomb": {
      "id": "xlsx-cinema-medium-02-bomb",
      "display": "Titanic",
      "normalized": "titanic",
      "aliases": [],
      "abbreviations": [],
      "alternativeSpellings": [],
      "accentInsensitiveVariants": [],
      "hyphenationVariants": [],
      "explanation": "Bombe fournie par la banque de questions source."
    },
    "explanation": "Question et panel importés tels quels depuis la banque Excel source.",
    "qualificationRule": "Les réponses sont celles fournies dans la banque Excel source.",